{
  "claim_scope": "admitted_backend_inference_smoke_only",
  "information_policy_id": "public-state-v1",
  "maximum_decisions_per_seed": 4,
  "model_id": "sha256:b0b727319ecd5544df519d703c190a01d08b0aa37f8098a3bc8bcbcfd33a0571",
  "patch_id": "sts2-v0.107.1-59260271",
  "policy_id": "production-checkpoint-policy-v1:sha256:b0b727319ecd5544df519d703c190a01d08b0aa37f8098a3bc8bcbcfd33a0571",
  "records": [
    {
      "candidate_action_ids": [
        "evangambit:ancient:0",
        "evangambit:ancient:1",
        "evangambit:ancient:2"
      ],
      "decision_index": 0,
      "decision_type": "event",
      "inference_seconds": 0.0050605,
      "representation_hash": "sha256:8978a9ee7c5a414d235379da5ba424bb6728fcb92dbf57be5613e4394727450b",
      "run_seed": 0,
      "selected_action_id": "evangambit:ancient:2",
      "selected_candidate_index": 2,
      "selected_policy_probability": 0.347692513337,
      "selected_tactical_death_risk": 0.100268239314,
      "state_hash": "bf50a5382709ff2bf681ac7652c336f83df08e9492bde1102a39b7bc329c9ed0"
    },
    {
      "candidate_action_ids": [
        "evangambit:ancient:0"
      ],
      "decision_index": 1,
      "decision_type": "event",
      "inference_seconds": 0.003627750091,
      "representation_hash": "sha256:ecd315abf383f67780c71be6c990ecfd5e8a0eb341a7edd4eaa6174f773d1aa0",
      "run_seed": 0,
      "selected_action_id": "evangambit:ancient:0",
      "selected_candidate_index": 0,
      "selected_policy_probability": 1.0,
      "selected_tactical_death_risk": 0.104264963271,
      "state_hash": "852f9109fc97404cc69e0aff7d77f6b671b042a913277dc66b96ec5815c9c83b"
    },
    {
      "candidate_action_ids": [
        "evangambit:map:0",
        "evangambit:map:1"
      ],
      "decision_index": 2,
      "decision_type": "path",
      "inference_seconds": 0.00667345908,
      "representation_hash": "sha256:ad6606d934ba2db893d5a0f58a66200980dbb729f5382c593d6c7d8208594721",
      "run_seed": 0,
      "selected_action_id": "evangambit:map:0",
      "selected_candidate_index": 0,
      "selected_policy_probability": 0.546305645977,
      "selected_tactical_death_risk": 0.142367921194,
      "state_hash": "a898799eb81c0384d38e4a5537d9cf9bc9c6d57ca4b43dc02011b4f64d57f018"
    },
    {
      "candidate_action_ids": [
        "evangambit:combat:0",
        "evangambit:combat:1:target:0",
        "evangambit:combat:1:target:1",
        "evangambit:combat:2",
        "evangambit:combat:3",
        "evangambit:combat:4:target:0",
        "evangambit:combat:4:target:1",
        "evangambit:combat:5"
      ],
      "decision_index": 3,
      "decision_type": "combat",
      "inference_seconds": 0.00574695901,
      "representation_hash": "sha256:9bbdf63f275b7dc1423ac9f2c00d264a1769f6fdacf1a8a672884b57ba55c760",
      "run_seed": 0,
      "selected_action_id": "evangambit:combat:1:target:1",
      "selected_candidate_index": 2,
      "selected_policy_probability": 0.222701296945,
      "selected_tactical_death_risk": 0.532232564225,
      "state_hash": "660b21f50786b331810774a3e6619ed4dda1597bd7b95533f5430b1c3e73f4d0"
    },
    {
      "candidate_action_ids": [
        "evangambit:ancient:0",
        "evangambit:ancient:1",
        "evangambit:ancient:2"
      ],
      "decision_index": 0,
      "decision_type": "event",
      "inference_seconds": 0.004583416041,
      "representation_hash": "sha256:1d86e1e0783fb7d1b3dc126ca61ffd44235125b9206056d2269059ce827d211c",
      "run_seed": 1,
      "selected_action_id": "evangambit:ancient:2",
      "selected_candidate_index": 2,
      "selected_policy_probability": 0.347628019674,
      "selected_tactical_death_risk": 0.102192999316,
      "state_hash": "1f54dee2a4821a6ef515b2638c0912b9a9389c1175eb34137462c82490a56d14"
    },
    {
      "candidate_action_ids": [
        "evangambit:ancient:0"
      ],
      "decision_index": 1,
      "decision_type": "event",
      "inference_seconds": 0.003664082964,
      "representation_hash": "sha256:81ef3d480e3ffb1101fa60f286a7f37f85395813e9e4ceb501839ff769741057",
      "run_seed": 1,
      "selected_action_id": "evangambit:ancient:0",
      "selected_candidate_index": 0,
      "selected_policy_probability": 1.0,
      "selected_tactical_death_risk": 0.102479967907,
      "state_hash": "70400a590c7c4fe7aed8f93ae631447b5422b0c702d6b8e8e71b394b0c15101f"
    },
    {
      "candidate_action_ids": [
        "evangambit:map:0",
        "evangambit:map:1"
      ],
      "decision_index": 2,
      "decision_type": "path",
      "inference_seconds": 0.006643499946,
      "representation_hash": "sha256:6c8846ce529d11f3c3acfd1a1168ed3861a41e4ac137e6cf95a320fbe351f173",
      "run_seed": 1,
      "selected_action_id": "evangambit:map:0",
      "selected_candidate_index": 0,
      "selected_policy_probability": 0.550743111915,
      "selected_tactical_death_risk": 0.139845216577,
      "state_hash": "14d10b3601252280780c4d081fedf87c1c2081402522a912b1b3b71a2542c2de"
    },
    {
      "candidate_action_ids": [
        "evangambit:combat:0",
        "evangambit:combat:2",
        "evangambit:combat:3:target:0",
        "evangambit:combat:3:target:1",
        "evangambit:combat:4:target:0",
        "evangambit:combat:4:target:1",
        "evangambit:combat:5"
      ],
      "decision_index": 3,
      "decision_type": "combat",
      "inference_seconds": 0.005513000069,
      "representation_hash": "sha256:74d627e8b981504f592f586b72a75c0bcd9c1bc206f776ee46e072f521606d25",
      "run_seed": 1,
      "selected_action_id": "evangambit:combat:3:target:1",
      "selected_candidate_index": 3,
      "selected_policy_probability": 0.208170306455,
      "selected_tactical_death_risk": 0.430898634861,
      "state_hash": "767f3c544b526f5e8d7e7ce3ffdb0d8b39c2878371f09700d8c1e26440704e7d"
    }
  ],
  "report_id": "sha256:80b9742fc4aaf2e5058904230d399eb3bc234c9970a6c1d99e299df611b9d058",
  "ruleset_manifest_id": "sha256:cd6340f6df24d0a279b10ed407a26681a160fb231aff727be93f38c280f2a41f",
  "schema_version": "production-model-inference-smoke-v1",
  "seeds": [
    0,
    1
  ],
  "summary": {
    "candidate_alignment_pass": true,
    "decisions": 8,
    "legal_selection_pass": true,
    "maximum_inference_seconds": 0.00667345908,
    "median_inference_seconds": 0.0050605,
    "p95_inference_seconds": 0.00667345908,
    "public_state_only": true,
    "terminal_seeds": 0
  },
  "training_report_id": "sha256:246f9a1ae30ee77f52ea22d3eb70a98828ba2f31d06191cf4a80ea64b2b9a434"
}
