{
  "claim_scope": "admitted_backend_inference_smoke_only",
  "information_policy_id": "public-state-v1",
  "maximum_decisions_per_seed": 4,
  "model_id": "sha256:327ba33da07880634c8d884312220ac61b8923f2ad0354b25c11d2ad4c56db2c",
  "patch_id": "sts2-v0.107.1-59260271",
  "policy_id": "production-checkpoint-policy-v1:sha256:327ba33da07880634c8d884312220ac61b8923f2ad0354b25c11d2ad4c56db2c",
  "records": [
    {
      "candidate_action_ids": [
        "evangambit:ancient:0",
        "evangambit:ancient:1",
        "evangambit:ancient:2"
      ],
      "decision_index": 0,
      "decision_type": "event",
      "inference_seconds": 0.005271250033,
      "representation_hash": "sha256:8978a9ee7c5a414d235379da5ba424bb6728fcb92dbf57be5613e4394727450b",
      "run_seed": 0,
      "selected_action_id": "evangambit:ancient:0",
      "selected_candidate_index": 0,
      "selected_policy_probability": 0.654970997945,
      "selected_tactical_death_risk": 0.014545482518,
      "state_hash": "bf50a5382709ff2bf681ac7652c336f83df08e9492bde1102a39b7bc329c9ed0"
    },
    {
      "candidate_action_ids": [
        "evangambit:relic_reward:0",
        "evangambit:relic_reward:1",
        "evangambit:relic_reward:3"
      ],
      "decision_index": 1,
      "decision_type": "relic_selection",
      "inference_seconds": 0.006454375107,
      "representation_hash": "sha256:037683615570d72ff19aeee9233988f83f355dbd871d38b8862f2db68f7d3aea",
      "run_seed": 0,
      "selected_action_id": "evangambit:relic_reward:0",
      "selected_candidate_index": 0,
      "selected_policy_probability": 0.337014020473,
      "selected_tactical_death_risk": 0.034515513404,
      "state_hash": "b80a17e64c149ef5ec004067a3013ebf6879a91c418dc244e3e3642d5db450a5"
    },
    {
      "candidate_action_ids": [
        "evangambit:card_reward:0",
        "evangambit:card_reward:1",
        "evangambit:card_reward:2",
        "evangambit:card_reward:3"
      ],
      "decision_index": 2,
      "decision_type": "reward",
      "inference_seconds": 0.005570165929,
      "representation_hash": "sha256:592d9974496059dfa28c52881e2273feca75970576591550cc73cef94dd7a902",
      "run_seed": 0,
      "selected_action_id": "evangambit:card_reward:0",
      "selected_candidate_index": 0,
      "selected_policy_probability": 0.373636610598,
      "selected_tactical_death_risk": 0.580877765642,
      "state_hash": "33812148586b65a7428109770d13fcd164958ccdafd62aebacb7f28656e0a03a"
    },
    {
      "candidate_action_ids": [
        "evangambit:relic_reward:0",
        "evangambit:relic_reward:3"
      ],
      "decision_index": 3,
      "decision_type": "relic_selection",
      "inference_seconds": 0.004476041999,
      "representation_hash": "sha256:4d86d1dfb35ab5090159a954a77ea8fa781c889d4b1ec873961bd2b704378a91",
      "run_seed": 0,
      "selected_action_id": "evangambit:relic_reward:0",
      "selected_candidate_index": 0,
      "selected_policy_probability": 0.50458891454,
      "selected_tactical_death_risk": 0.034751535757,
      "state_hash": "f0d73adc12cd023d27a90934a5d36ebf9379ceb18a2e2337943c3a91ddd76d55"
    },
    {
      "candidate_action_ids": [
        "evangambit:ancient:0",
        "evangambit:ancient:1",
        "evangambit:ancient:2"
      ],
      "decision_index": 0,
      "decision_type": "event",
      "inference_seconds": 0.004754540976,
      "representation_hash": "sha256:1d86e1e0783fb7d1b3dc126ca61ffd44235125b9206056d2269059ce827d211c",
      "run_seed": 1,
      "selected_action_id": "evangambit:ancient:0",
      "selected_candidate_index": 0,
      "selected_policy_probability": 0.654317668526,
      "selected_tactical_death_risk": 0.014568604941,
      "state_hash": "1f54dee2a4821a6ef515b2638c0912b9a9389c1175eb34137462c82490a56d14"
    },
    {
      "candidate_action_ids": [
        "evangambit:ancient:0"
      ],
      "decision_index": 1,
      "decision_type": "event",
      "inference_seconds": 0.004142375081,
      "representation_hash": "sha256:3c0b4ec6d762ffdfc90168520acf5956ad57fd4d913c63d58913734c73910ad9",
      "run_seed": 1,
      "selected_action_id": "evangambit:ancient:0",
      "selected_candidate_index": 0,
      "selected_policy_probability": 1.0,
      "selected_tactical_death_risk": 0.012000949829,
      "state_hash": "28ee866af385bd98086f5d7c99fb5609fcf8fe6b36e976e1ed3db60f287f4344"
    },
    {
      "candidate_action_ids": [
        "evangambit:map:0",
        "evangambit:map:1"
      ],
      "decision_index": 2,
      "decision_type": "path",
      "inference_seconds": 0.007243665983,
      "representation_hash": "sha256:58984259fa74e2e4714368cc1a5d5ecaa00ec4b0358105cf5e4387ab1e18d7d4",
      "run_seed": 1,
      "selected_action_id": "evangambit:map:0",
      "selected_candidate_index": 0,
      "selected_policy_probability": 0.697988961393,
      "selected_tactical_death_risk": 0.495897351414,
      "state_hash": "c1926a6cf4df29b5efb848458f652b01460b169344c48811498cb36cf018697b"
    },
    {
      "candidate_action_ids": [
        "evangambit:combat:0:target:0",
        "evangambit:combat:0:target:1",
        "evangambit:combat:1",
        "evangambit:combat:2:target:0",
        "evangambit:combat:2:target:1",
        "evangambit:combat:3:target:0",
        "evangambit:combat:3:target:1",
        "evangambit:combat:4:target:0",
        "evangambit:combat:4:target:1",
        "evangambit:combat:5"
      ],
      "decision_index": 3,
      "decision_type": "combat",
      "inference_seconds": 0.006793791079,
      "representation_hash": "sha256:97f3bcdebfa14a715d332c0b82f0f5d75f7398c2b561f6aa10b1c1a68f1d716d",
      "run_seed": 1,
      "selected_action_id": "evangambit:combat:0:target:1",
      "selected_candidate_index": 1,
      "selected_policy_probability": 0.214883523997,
      "selected_tactical_death_risk": 0.212202872037,
      "state_hash": "3706eb18a9514bb9721de7ebabad6613cddd21369605490bcdb904f98163813a"
    }
  ],
  "report_id": "sha256:eb02b268cc0f24cc750755098d0e13eb95efc3b452e9621b3f7244ba7fff4ec3",
  "ruleset_manifest_id": "sha256:cd6340f6df24d0a279b10ed407a26681a160fb231aff727be93f38c280f2a41f",
  "schema_version": "production-model-inference-smoke-v1",
  "seeds": [
    0,
    1
  ],
  "summary": {
    "candidate_alignment_pass": true,
    "decisions": 8,
    "legal_selection_pass": true,
    "maximum_inference_seconds": 0.007243665983,
    "median_inference_seconds": 0.005271250033,
    "p95_inference_seconds": 0.007243665983,
    "public_state_only": true,
    "terminal_seeds": 0
  },
  "training_report_id": "sha256:6cc0f8d7728636c87ab5ecf0e64f5ae420d2b3a87394c7bc0d921a13fa5c7543"
}
